{
  "schema_version": 1,
  "kind": "semantic_acceptance_spec",
  "review_id": "SEMREVIEW_DD69CD752A6E46181BAC",
  "accept": [
    "SEMPROP_006DAFA033359204B91A",
    "SEMPROP_008A780770E7FDB4D8EB",
    "SEMPROP_08984D1AFA0D5CEEEAE8",
    "SEMPROP_0CCBC44D6E08115D1392",
    "SEMPROP_149BA3043732F26230E9",
    "SEMPROP_1D6E6865A9A78965AB2C",
    "SEMPROP_2E2565FA5B9406F03093",
    "SEMPROP_31219C965AC3A2C55B5F",
    "SEMPROP_318377C9DEB3E2F715FE",
    "SEMPROP_3BB68104BE5AE6C76676",
    "SEMPROP_424ADF45DC0D9D11A8BE",
    "SEMPROP_44D6A25447470D416C3C",
    "SEMPROP_4BD90F2F211EC92E85E5",
    "SEMPROP_553B9C7A1B2661146287",
    "SEMPROP_5575F4DC1EDA59B5964E",
    "SEMPROP_60A9A0D39AC4CE37F51E",
    "SEMPROP_73F28BE72A9967178F86",
    "SEMPROP_7B77BDB6C583AFC8678A",
    "SEMPROP_7F794D5CA7E8A003BB5F",
    "SEMPROP_8103C2ADCBD6F2D4BCEE",
    "SEMPROP_859178D9EA8C626B246C",
    "SEMPROP_86A13F269544CF22DF1D",
    "SEMPROP_86D6DD74C2AC570DCC94",
    "SEMPROP_8DF5C13962ED758A15B8",
    "SEMPROP_8E177F2E580008A0A2AD",
    "SEMPROP_9A4708CD0CCBD4A92C66",
    "SEMPROP_A8CC480C3293E2CB6A8E",
    "SEMPROP_A9617526BD3E6991B900",
    "SEMPROP_B11F7525F8100F4CC7D9",
    "SEMPROP_B3F6742C1CD5AC29C3BD",
    "SEMPROP_BD8E042FD546EC475022",
    "SEMPROP_C515872B379F5D8F9796",
    "SEMPROP_C55E446631CB46D65EDA",
    "SEMPROP_D5C1B523A5C3AAA84BE9",
    "SEMPROP_E4387C5319408C5177F3",
    "SEMPROP_E6CBED5947C972491DC8",
    "SEMPROP_EAD08F14A9EF4A45BD3B",
    "SEMPROP_EC16E8C90A25B1AB0CCB",
    "SEMPROP_EF03C5CAFC63646BC3D8"
  ]
}
